{
  "handoff_id": "source-pilot-operator-handoff-2026-05-21-v075e",
  "generated_at": "2026-05-21T14:00:00.000Z",
  "status": "operator_handoff_ready",
  "mode": "fixture_only",
  "runtime_status": "source_pilot_operator_handoff_ready",
  "runtime_flags": {
    "live_ingestion_enabled": false,
    "scheduled_monitoring_enabled": false,
    "network_execution_enabled": false
  },
  "gates": {
    "verified_on_source": false,
    "client_use_allowed": false,
    "client_evidence_allowed": false,
    "final_evidence_allowed": false,
    "legal_change_claimed": false,
    "publication_allowed": false,
    "public_export_allowed": false
  },
  "db_health_status": "not_configured",
  "source_count": 2,
  "candidate_count": 1,
  "packet_count": 1,
  "sources_summary": [
    {
      "source_id": "edpb-publications-rss",
      "source_name": "European Data Protection Board (EDPB) — publications RSS",
      "jurisdiction": "eu",
      "source_type": "rss",
      "monitoring_status": "manual_only",
      "official_url": "https://www.edpb.europa.eu/feed/publications_en",
      "fixture_snapshot_version": "v2",
      "item_count": 3,
      "metadata_hash": "8875ea2c41173b83",
      "allowed_for_network_check": false,
      "has_fixture_candidate": true
    },
    {
      "source_id": "edps-news-rss",
      "source_name": "European Data Protection Supervisor (EDPS) — news RSS",
      "jurisdiction": "eu",
      "source_type": "rss",
      "monitoring_status": "design_ready",
      "official_url": "https://www.edps.europa.eu/feed/news_en",
      "fixture_snapshot_version": "v1",
      "item_count": 1,
      "metadata_hash": "b57195d738e1e8f8",
      "allowed_for_network_check": false,
      "has_fixture_candidate": false
    }
  ],
  "candidates_summary": [
    {
      "candidate_id": "sp-review-edpb-publications-rss-edpb-fixture-003-fixture",
      "source_id": "edpb-publications-rss",
      "source_name": "European Data Protection Board (EDPB) — publications RSS",
      "change_type": "added",
      "candidate_status": "new_metadata_detected",
      "reviewer_status": "pending_review",
      "detected_at": "2026-05-21T10:00:00.000Z",
      "title": "EDPB new publication notice (fixture v2 — new item)",
      "official_url": "https://www.edpb.europa.eu/news/news/2026/edpb-fixture-003",
      "metadata_fields_changed": [
        "item_added"
      ],
      "packet_id": "sp-packet-sp-review-edpb-publications-rss-edpb-fixture-003-fixture"
    }
  ],
  "decision_packets_summary": [
    {
      "packet_id": "sp-packet-sp-review-edpb-publications-rss-edpb-fixture-003-fixture",
      "candidate_id": "sp-review-edpb-publications-rss-edpb-fixture-003-fixture",
      "source_id": "edpb-publications-rss",
      "packet_status": "blocked_no_supabase",
      "reviewer_status": "pending_review",
      "change_type": "added",
      "blocked_until": [
        "supabase_not_configured",
        "network_execution_disabled",
        "source_not_verified_on_source",
        "evidence_gates_closed",
        "publication_gates_closed",
        "no_legal_conclusion_allowed",
        "fixture_only_no_live_ingestion"
      ],
      "checklist_item_count": 5
    }
  ],
  "blocked_reasons": [
    "evidence_gates_closed",
    "fixture_only_no_live_ingestion",
    "network_execution_disabled",
    "no_legal_conclusion_allowed",
    "publication_gates_closed",
    "source_not_verified_on_source",
    "supabase_not_configured"
  ],
  "required_next_actions": [
    {
      "id": "supabase_credentials",
      "label": "Add Supabase credentials via .env.runtime.local (not committed)",
      "blocked_by": "supabase_not_configured"
    },
    {
      "id": "apply_schema",
      "label": "Apply ops/supabase runtime schema when credentials exist (manual, flag-gated)",
      "blocked_by": "supabase_not_configured"
    },
    {
      "id": "connect_pilot_db",
      "label": "Connect pilot snapshots, review candidates, and packets to runtime DB (T075B)",
      "blocked_by": "supabase_not_configured"
    },
    {
      "id": "controlled_network_later",
      "label": "Only after Control Tower approval: single allowlisted network check (T076+)",
      "blocked_by": "network_execution_disabled"
    }
  ],
  "operator_checklist": [
    {
      "id": "review_handoff_summary",
      "label": "Review operator handoff summary counts and blocked reasons",
      "required": true,
      "completed_placeholder": false
    },
    {
      "id": "confirm_fixture_chain",
      "label": "Confirm fixture-only pilot chain (status → candidates → packets)",
      "required": true,
      "completed_placeholder": false
    },
    {
      "id": "inspect_candidate_metadata",
      "label": "Inspect candidate metadata hashes and fields changed (not legal text)",
      "required": true,
      "completed_placeholder": false
    },
    {
      "id": "triage_decision_packet",
      "label": "Open decision packet checklist and placeholder triage (offline only)",
      "required": true,
      "completed_placeholder": false
    },
    {
      "id": "no_gate_approval",
      "label": "Do not approve evidence, publication, or verify-on-source in this export",
      "required": true,
      "completed_placeholder": false
    }
  ],
  "safety_summary": {
    "metadata_only": true,
    "fixture_only": true,
    "no_full_legal_text": true,
    "no_raw_page_body": true,
    "runtime_flags_disabled": true,
    "all_gates_closed": true,
    "db_persistence": "not_available",
    "public_note": "T075E offline operator handoff. Summarizes fixture-only source pilot chain for internal review. Not legal verification; not publication approval."
  },
  "cannot_claim_yet": [
    {
      "id": "not_source_verified",
      "label": "Source is not verified on official source",
      "detail": "verified_on_source remains false; fixture metadata only."
    },
    {
      "id": "not_legal_change_claimed",
      "label": "No legal or regulatory change conclusion",
      "detail": "legal_change_claimed remains false; metadata diff is not legal verification."
    },
    {
      "id": "not_client_usable",
      "label": "Not approved for client use",
      "detail": "client_use_allowed remains false."
    },
    {
      "id": "not_evidence",
      "label": "Not approved for client or final evidence",
      "detail": "client_evidence_allowed and final_evidence_allowed remain false."
    },
    {
      "id": "not_publication_approved",
      "label": "Not publication or public export approved",
      "detail": "publication_allowed and public_export_allowed remain false."
    },
    {
      "id": "no_live_monitoring",
      "label": "No live ingestion or scheduled monitoring",
      "detail": "live_ingestion_enabled and scheduled_monitoring_enabled remain false."
    },
    {
      "id": "no_network_execution",
      "label": "No network execution against official sources",
      "detail": "network_execution_enabled remains false; no live RSS fetch."
    },
    {
      "id": "no_supabase_persistence",
      "label": "No Supabase/runtime DB persistence",
      "detail": "Runtime DB health is not_configured; packets blocked until credentials and schema."
    }
  ],
  "links": {
    "source_pilot_page": "/source-pilot/",
    "source_pilot_review_page": "/source-pilot/review/",
    "source_pilot_decision_packets_page": "/source-pilot/decision-packets/",
    "operator_handoff_page": "/source-pilot/operator-handoff/",
    "automation_page": "/automation/",
    "runtime_health_page": "/runtime-health/",
    "handoff_json": "/data/source-pilot-operator-handoff.json",
    "status_json": "/data/source-pilot-status.json",
    "review_candidates_json": "/data/source-pilot-review-candidates.json",
    "decision_packets_json": "/data/source-pilot-decision-packets.json",
    "runtime_db_health_json": "/data/runtime-db-health.json",
    "automation_runtime_manifest_json": "/data/automation-runtime-manifest.json",
    "handoff_markdown_report": "/reports/source-pilot-operator-handoff.md",
    "manifest_version": "1.0.26"
  },
  "public_note": "T075E offline operator handoff export. Metadata-only summary of fixture source pilot (2 sources, review candidates, decision packets). Supabase not configured; network and ingestion disabled; all evidence and publication gates closed."
}
